{
  "source": "https://github.com/KubaCiolo/leksjo-dane/blob/main/dane/nkjp-frekwencja.csv",
  "license": "CC BY 4.0",
  "corpus": "NKJP 1.2 manually annotated 1M subcorpus",
  "items": [
    {
      "rank": 1,
      "lemma": "w",
      "count": 31620
    },
    {
      "rank": 2,
      "lemma": "być",
      "count": 28380
    },
    {
      "rank": 3,
      "lemma": "i",
      "count": 21991
    },
    {
      "rank": 4,
      "lemma": "się",
      "count": 18733
    },
    {
      "rank": 5,
      "lemma": "z",
      "count": 18108
    },
    {
      "rank": 6,
      "lemma": "na",
      "count": 17639
    },
    {
      "rank": 7,
      "lemma": "nie",
      "count": 16939
    },
    {
      "rank": 8,
      "lemma": "on",
      "count": 13359
    },
    {
      "rank": 9,
      "lemma": "to",
      "count": 13270
    },
    {
      "rank": 10,
      "lemma": "do",
      "count": 11824
    },
    {
      "rank": 11,
      "lemma": "że",
      "count": 9144
    },
    {
      "rank": 12,
      "lemma": "ten",
      "count": 8992
    },
    {
      "rank": 13,
      "lemma": "o",
      "count": 7163
    },
    {
      "rank": 14,
      "lemma": "mieć",
      "count": 6758
    },
    {
      "rank": 15,
      "lemma": "który",
      "count": 6635
    },
    {
      "rank": 16,
      "lemma": "a",
      "count": 6232
    },
    {
      "rank": 17,
      "lemma": "jak",
      "count": 4565
    },
    {
      "rank": 18,
      "lemma": "ja",
      "count": 4500
    },
    {
      "rank": 19,
      "lemma": "co",
      "count": 4364
    },
    {
      "rank": 20,
      "lemma": "po",
      "count": 4344
    },
    {
      "rank": 21,
      "lemma": "ale",
      "count": 4343
    },
    {
      "rank": 22,
      "lemma": "tak",
      "count": 3846
    },
    {
      "rank": 23,
      "lemma": "za",
      "count": 3775
    },
    {
      "rank": 24,
      "lemma": "od",
      "count": 3740
    },
    {
      "rank": 25,
      "lemma": "móc",
      "count": 3445
    },
    {
      "rank": 26,
      "lemma": "rok",
      "count": 3413
    },
    {
      "rank": 27,
      "lemma": "by",
      "count": 3198
    },
    {
      "rank": 28,
      "lemma": "przez",
      "count": 3010
    },
    {
      "rank": 29,
      "lemma": "taki",
      "count": 2926
    },
    {
      "rank": 30,
      "lemma": "czy",
      "count": 2819
    },
    {
      "rank": 31,
      "lemma": "już",
      "count": 2764
    },
    {
      "rank": 32,
      "lemma": "pan",
      "count": 2500
    },
    {
      "rank": 33,
      "lemma": "no",
      "count": 2479
    },
    {
      "rank": 34,
      "lemma": "swój",
      "count": 2424
    },
    {
      "rank": 35,
      "lemma": "dla",
      "count": 2401
    },
    {
      "rank": 36,
      "lemma": "bardzo",
      "count": 2276
    },
    {
      "rank": 37,
      "lemma": "tylko",
      "count": 2268
    },
    {
      "rank": 38,
      "lemma": "siebie",
      "count": 2125
    },
    {
      "rank": 39,
      "lemma": "bo",
      "count": 2028
    },
    {
      "rank": 40,
      "lemma": "wiedzieć",
      "count": 2005
    },
    {
      "rank": 41,
      "lemma": "mówić",
      "count": 1987
    },
    {
      "rank": 42,
      "lemma": "jeden",
      "count": 1936
    },
    {
      "rank": 43,
      "lemma": "chcieć",
      "count": 1806
    },
    {
      "rank": 44,
      "lemma": "człowiek",
      "count": 1792
    },
    {
      "rank": 45,
      "lemma": "czas",
      "count": 1786
    },
    {
      "rank": 46,
      "lemma": "inny",
      "count": 1783
    },
    {
      "rank": 47,
      "lemma": "też",
      "count": 1770
    },
    {
      "rank": 48,
      "lemma": "my",
      "count": 1714
    },
    {
      "rank": 49,
      "lemma": "jeszcze",
      "count": 1670
    },
    {
      "rank": 50,
      "lemma": "zostać",
      "count": 1635
    },
    {
      "rank": 51,
      "lemma": "sam",
      "count": 1604
    },
    {
      "rank": 52,
      "lemma": "ty",
      "count": 1589
    },
    {
      "rank": 53,
      "lemma": "sprawa",
      "count": 1500
    },
    {
      "rank": 54,
      "lemma": "dwa",
      "count": 1495
    },
    {
      "rank": 55,
      "lemma": "przed",
      "count": 1487
    },
    {
      "rank": 56,
      "lemma": "oraz",
      "count": 1486
    },
    {
      "rank": 57,
      "lemma": "raz",
      "count": 1421
    },
    {
      "rank": 58,
      "lemma": "powiedzieć",
      "count": 1415
    },
    {
      "rank": 59,
      "lemma": "polski",
      "count": 1412
    },
    {
      "rank": 60,
      "lemma": "pierwszy",
      "count": 1382
    },
    {
      "rank": 61,
      "lemma": "nasz",
      "count": 1379
    },
    {
      "rank": 62,
      "lemma": "praca",
      "count": 1378
    },
    {
      "rank": 63,
      "lemma": "jednak",
      "count": 1376
    },
    {
      "rank": 64,
      "lemma": "tam",
      "count": 1365
    },
    {
      "rank": 65,
      "lemma": "przy",
      "count": 1344
    },
    {
      "rank": 66,
      "lemma": "dzień",
      "count": 1337
    },
    {
      "rank": 67,
      "lemma": "musieć",
      "count": 1288
    },
    {
      "rank": 68,
      "lemma": "nowy",
      "count": 1282
    },
    {
      "rank": 69,
      "lemma": "mój",
      "count": 1262
    },
    {
      "rank": 70,
      "lemma": "lub",
      "count": 1242
    },
    {
      "rank": 71,
      "lemma": "pod",
      "count": 1237
    },
    {
      "rank": 72,
      "lemma": "osoba",
      "count": 1196
    },
    {
      "rank": 73,
      "lemma": "jaki",
      "count": 1194
    },
    {
      "rank": 74,
      "lemma": "wszystko",
      "count": 1174
    },
    {
      "rank": 75,
      "lemma": "nawet",
      "count": 1168
    },
    {
      "rank": 76,
      "lemma": "życie",
      "count": 1138
    },
    {
      "rank": 77,
      "lemma": "cały",
      "count": 1133
    },
    {
      "rank": 78,
      "lemma": "polska",
      "count": 1115
    },
    {
      "rank": 79,
      "lemma": "wszystek",
      "count": 1097
    },
    {
      "rank": 80,
      "lemma": "jakiś",
      "count": 1093
    },
    {
      "rank": 81,
      "lemma": "dobry",
      "count": 1085
    },
    {
      "rank": 82,
      "lemma": "można",
      "count": 1082
    },
    {
      "rank": 83,
      "lemma": "duży",
      "count": 1057
    },
    {
      "rank": 84,
      "lemma": "teraz",
      "count": 1056
    },
    {
      "rank": 85,
      "lemma": "miejsce",
      "count": 1045
    },
    {
      "rank": 86,
      "lemma": "dziecko",
      "count": 1040
    },
    {
      "rank": 87,
      "lemma": "coś",
      "count": 1018
    },
    {
      "rank": 88,
      "lemma": "więc",
      "count": 1008
    },
    {
      "rank": 89,
      "lemma": "jako",
      "count": 991
    },
    {
      "rank": 90,
      "lemma": "także",
      "count": 984
    },
    {
      "rank": 91,
      "lemma": "każdy",
      "count": 981
    },
    {
      "rank": 92,
      "lemma": "gdy",
      "count": 963
    },
    {
      "rank": 93,
      "lemma": "1",
      "count": 961
    },
    {
      "rank": 94,
      "lemma": "kto",
      "count": 944
    },
    {
      "rank": 95,
      "lemma": "żeby",
      "count": 917
    },
    {
      "rank": 96,
      "lemma": "bez",
      "count": 913
    },
    {
      "rank": 97,
      "lemma": "dobrze",
      "count": 913
    },
    {
      "rank": 98,
      "lemma": "pani",
      "count": 910
    },
    {
      "rank": 99,
      "lemma": "tu",
      "count": 901
    },
    {
      "rank": 100,
      "lemma": "drugi",
      "count": 893
    },
    {
      "rank": 101,
      "lemma": "stać",
      "count": 887
    },
    {
      "rank": 102,
      "lemma": "kiedy",
      "count": 885
    },
    {
      "rank": 103,
      "lemma": "2",
      "count": 880
    },
    {
      "rank": 104,
      "lemma": "dom",
      "count": 880
    },
    {
      "rank": 105,
      "lemma": "kilka",
      "count": 880
    },
    {
      "rank": 106,
      "lemma": "wiele",
      "count": 873
    },
    {
      "rank": 107,
      "lemma": "nad",
      "count": 867
    },
    {
      "rank": 108,
      "lemma": "nic",
      "count": 856
    },
    {
      "rank": 109,
      "lemma": "wielki",
      "count": 856
    },
    {
      "rank": 110,
      "lemma": "może",
      "count": 854
    },
    {
      "rank": 111,
      "lemma": "miasto",
      "count": 831
    },
    {
      "rank": 112,
      "lemma": "prawo",
      "count": 799
    },
    {
      "rank": 113,
      "lemma": "świat",
      "count": 790
    },
    {
      "rank": 114,
      "lemma": "jeśli",
      "count": 780
    },
    {
      "rank": 115,
      "lemma": "powinien",
      "count": 774
    },
    {
      "rank": 116,
      "lemma": "właśnie",
      "count": 769
    },
    {
      "rank": 117,
      "lemma": "widzieć",
      "count": 765
    },
    {
      "rank": 118,
      "lemma": "gdzie",
      "count": 764
    },
    {
      "rank": 119,
      "lemma": "strona",
      "count": 760
    },
    {
      "rank": 120,
      "lemma": "niż",
      "count": 734
    },
    {
      "rank": 121,
      "lemma": "również",
      "count": 724
    },
    {
      "rank": 122,
      "lemma": "koniec",
      "count": 721
    },
    {
      "rank": 123,
      "lemma": "u",
      "count": 720
    },
    {
      "rank": 124,
      "lemma": "poseł",
      "count": 719
    },
    {
      "rank": 125,
      "lemma": "zrobić",
      "count": 715
    },
    {
      "rank": 126,
      "lemma": "aby",
      "count": 714
    },
    {
      "rank": 127,
      "lemma": "państwo",
      "count": 714
    },
    {
      "rank": 128,
      "lemma": "wysoki",
      "count": 701
    },
    {
      "rank": 129,
      "lemma": "3",
      "count": 689
    },
    {
      "rank": 130,
      "lemma": "droga",
      "count": 685
    },
    {
      "rank": 131,
      "lemma": "trzeba",
      "count": 684
    },
    {
      "rank": 132,
      "lemma": "trzy",
      "count": 684
    },
    {
      "rank": 133,